{
  "schema_version": "1.0",
  "message_id": "00000000-0000-4000-8000-000000000003",
  "session_id": "00000000-0000-4000-8000-0000000000a1",
  "user_id": "synthetic-user-1",
  "produced_at": "2026-10-06T06:00:01.020Z",
  "kind": "observation",
  "body": {
    "schema_version": "2.0",
    "sequence": 0,
    "start_ms": 0,
    "end_ms": 1000,
    "phase": "running",
    "valid": true,
    "collapse_probability": 0.9,
    "deviation_type": "forward_slouch",
    "model_version": "synthetic-v1"
  }
}
